{
  "$schema": "https://raw.githubusercontent.com/liangboqiang/TjuaeHub/main/schemas/engine-adapter-definition.v1.schema.json",
  "schemaVersion": 1,
  "kind": "engineAdapter",
  "id": "goose",
  "runtimeId": "goose",
  "displayName": "Goose",
  "description": "通过 ACP 接入 Goose 的引擎适配器。",
  "icon": "resources/icon.svg",
  "protocol": {
    "type": "acp",
    "transport": "stdio",
    "arguments": ["acp"]
  },
  "runtime": {
    "commandName": "goose"
  },
  "capabilities": {
    "streaming": true,
    "skillsDirectories": [".goose/skills"]
  }
}
