{
  "$schema": "https://raw.githubusercontent.com/liangboqiang/TjuaeHub/main/schemas/engine-adapter-definition.v1.schema.json",
  "schemaVersion": 1,
  "kind": "engineAdapter",
  "id": "qwen",
  "runtimeId": "qwen",
  "displayName": "Qwen Code",
  "description": "通过 ACP 接入 Qwen Code 的引擎适配器。",
  "icon": "resources/icon.svg",
  "protocol": {
    "type": "acp",
    "transport": "stdio",
    "arguments": ["--acp"]
  },
  "runtime": {
    "commandName": "qwen"
  },
  "capabilities": {
    "streaming": true,
    "skillsDirectories": [".qwen/skills"]
  }
}
