{
  "$schema": "https://raw.githubusercontent.com/liangboqiang/TjuaeHub/main/schemas/engine-adapter-definition.v1.schema.json",
  "schemaVersion": 1,
  "kind": "engineAdapter",
  "id": "kimi",
  "runtimeId": "kimi",
  "displayName": "Kimi Code",
  "description": "通过 ACP 接入 Kimi Code 的候选引擎适配器。",
  "icon": "resources/icon.svg",
  "protocol": {
    "type": "acp",
    "transport": "stdio",
    "arguments": ["acp"]
  },
  "runtime": {
    "commandName": "kimi"
  },
  "capabilities": {
    "streaming": false,
    "authenticationRequired": true
  }
}
