{
  "$schema": "https://raw.githubusercontent.com/liangboqiang/TjuaeHub/main/schemas/engine-adapter-definition.v1.schema.json",
  "schemaVersion": 1,
  "kind": "engineAdapter",
  "id": "mistral-vibe",
  "runtimeId": "mistral-vibe",
  "displayName": "Mistral Vibe",
  "description": "通过 ACP 接入 Mistral Vibe 的候选引擎适配器。",
  "icon": "resources/icon.svg",
  "protocol": {
    "type": "acp",
    "transport": "stdio",
    "arguments": []
  },
  "runtime": {
    "commandName": "vibe-acp"
  },
  "capabilities": {
    "streaming": false,
    "authenticationRequired": true
  }
}
